{
  "$schema": "https://json-schema.org/draft/2020-12/schema",
  "$id": "https://lubbertdas.github.io/landloper/schemas/pack-1.schema.json",
  "title": "Landloper content pack",
  "description": "Schema version 1. Validates a pack.json both as authored and after tooling has written derived fields: `position` and media dimensions are optional here, and required at ship time by the Stage 2a validator. Cross-field rules (realValue ordering, media cross-references) are not expressible in JSON Schema and live in src/content/positions.ts.",
  "type": "object",
  "additionalProperties": false,
  "required": [
    "schemaVersion",
    "id",
    "title",
    "description",
    "domainType",
    "locale",
    "version",
    "coverImage",
    "scalingModel",
    "realUnitLabel",
    "suggestedDistancesM",
    "media",
    "milestones"
  ],
  "properties": {
    "schemaVersion": {
      "const": 1,
      "description": "Version of the pack format. Bumped only by a breaking change to this schema."
    },
    "id": {
      "$ref": "#/$defs/kebabId",
      "description": "Stable and unique across all packs. Never reused."
    },
    "title": { "type": "string", "minLength": 1 },
    "description": { "type": "string", "minLength": 1 },
    "domainType": {
      "type": "string",
      "minLength": 1,
      "description": "Label only. Never branched on in code."
    },
    "locale": {
      "type": "string",
      "pattern": "^[a-z]{2}(-[A-Z]{2})?$",
      "description": "Metadata only in v1; no i18n machinery."
    },
    "version": {
      "type": "string",
      "pattern": "^\\d+\\.\\d+\\.\\d+(-[0-9A-Za-z.-]+)?$",
      "description": "Semver, for the pack's own content."
    },
    "coverImage": {
      "$ref": "#/$defs/mediaRef",
      "description": "Must also appear in the media table."
    },
    "scalingModel": {
      "const": "fit-to-distance",
      "description": "The only legal value. Reserved so a future model needs no migration."
    },
    "realUnitLabel": {
      "type": "string",
      "minLength": 1,
      "description": "Display only, e.g. \"km\", \"years\", \"million km\"."
    },
    "suggestedDistancesM": {
      "type": "array",
      "minItems": 1,
      "uniqueItems": true,
      "items": {
        "type": "integer",
        "exclusiveMinimum": 0
      },
      "description": "Journey distances offered in the setup flow, in metres."
    },
    "media": {
      "type": "array",
      "items": { "$ref": "#/$defs/mediaAsset" },
      "description": "Every asset in the pack, keyed by its relative path."
    },
    "milestones": {
      "type": "array",
      "minItems": 1,
      "items": { "$ref": "#/$defs/milestone" },
      "description": "Ordered by non-decreasing realValue."
    }
  },
  "$defs": {
    "kebabId": {
      "type": "string",
      "pattern": "^[a-z0-9]+(-[a-z0-9]+)*$"
    },
    "mediaRef": {
      "type": "string",
      "minLength": 1,
      "pattern": "^[A-Za-z0-9_-][A-Za-z0-9._-]*(/[A-Za-z0-9_-][A-Za-z0-9._-]*)*$",
      "description": "A relative path inside the pack folder. The pattern forbids a leading slash, a URL scheme, and any segment beginning with a dot, which rules out `..` traversal and hidden files."
    },
    "mediaAsset": {
      "type": "object",
      "additionalProperties": false,
      "required": ["ref", "type"],
      "properties": {
        "ref": { "$ref": "#/$defs/mediaRef" },
        "type": {
          "enum": ["image", "audio"],
          "description": "\"audio\" is reserved and unused in v1."
        },
        "thumbnailRef": { "$ref": "#/$defs/mediaRef" },
        "caption": {
          "type": "string",
          "description": "Displayed with the image; also serves as alt text."
        },
        "attribution": { "type": "string" },
        "width": {
          "type": "integer",
          "exclusiveMinimum": 0,
          "description": "Written by the media pipeline, not authored."
        },
        "height": {
          "type": "integer",
          "exclusiveMinimum": 0,
          "description": "Written by the media pipeline, not authored."
        },
        "bytes": {
          "type": "integer",
          "exclusiveMinimum": 0,
          "description": "Written by the media pipeline, not authored."
        }
      }
    },
    "milestone": {
      "type": "object",
      "additionalProperties": false,
      "required": ["id", "realValue", "title", "body", "mediaRefs", "notification"],
      "properties": {
        "id": {
          "$ref": "#/$defs/kebabId",
          "description": "Unique within the pack."
        },
        "realValue": {
          "type": "number",
          "description": "Authored position in realUnitLabel units. Non-decreasing across the array."
        },
        "position": {
          "type": "number",
          "minimum": 0,
          "maximum": 1,
          "description": "Derived, never authored. Written by the validator from realValue."
        },
        "title": { "type": "string", "minLength": 1 },
        "body": { "type": "string", "minLength": 1 },
        "mediaRefs": {
          "type": "array",
          "items": { "$ref": "#/$defs/mediaRef" },
          "description": "Each must appear in the pack's media table."
        },
        "notification": {
          "type": "object",
          "additionalProperties": false,
          "required": ["title", "body"],
          "properties": {
            "title": { "type": "string", "minLength": 1 },
            "body": { "type": "string", "minLength": 1 }
          },
          "description": "Fully authored strings. Code never assembles domain sentences or formats domain numbers."
        }
      }
    }
  }
}
